Index,Comment
1,"Cái vỏ với màu không liên quan, mà son khá đẹp nha. Đánh nhẹ nhẹ nhìn môi cưng lắm
Bạn nào môi tối màu nên cân nhắc tại sợ sẽ hơi ánh tím hoặc có thể che khuyết điểm môi trước khi đánh son
Chất son dính dính hơi khó chịu nhưng khi để tầm 15p son set lại trên môi thì uống nước không dính ống hút không trôi luôn, môi cứng căng căng nhìn thích lắm. Must try "
2,Son xài êm đánh lớp mỏng nhẹ là tới tối môi vẫn hồng
3,"Độ bám màu tốt, Thành phần sản phẩm an toàn, không gây kích ứng"
4,"Chất son lên màu chuẩn, mướt, Độ bám màu tốt, Màu son đẹp, Thành phần sản phẩm an toàn, không gây kích ứng"
